{
  "$schema": "http://json-schema.org/draft-04/schema#",
  "type": "object",
  "properties": {
    "id": {
      "type": "string"
    },
    "name": {
      "type": "string"
    },
    "excerpt": {
      "type": "string"
    },
    "content": {
      "type": "string"
    },
    "thumbnail": {
      "type": "string"
    },
    "created": {
      "type": "string"
    },
    "events": {
      "type": "array",
      "items": {
        "$ref": "/TimelineEventSchema"
      }

    },
    "publishStatus": {
      "type": "string"
    },
    "admins": {
      "type": "array",
      "items": [
        {
          "type": "string"
        },
        {
          "type": "string"
        }
      ]
    },
    "tags": {
      "type": "array",
      "items": [
        {
          "type": "string"
        },
        {
          "type": "string"
        }
      ]
    },
    "priority": {
      "type": "integer"
    }
  },
  "required": [
    "admins",
    "id",
    "name",
    "excerpt",
    "content",
    "created",
    "publishStatus",
    "events",
    "priority",
    "tags"
  ],
  "additionalProperties": false
}
