{
  "id": "aave-governance-timeline",
  "name": "AAVE Governance Timeline",
  "excerpt": "Captures timeline of all the governance updates",
  "content": "Captures timeline of all the governance updates",
  "thumbnail": "ipfs://QmNd8S5Z9T8cWv95UUjn5fYR1wU8nLWjeHzXoRC5oVcVe8",
  "created": "2022-11-15T20:00:13.043Z",
  "publishStatus": "Live",
  "priority": 50,
  "admins": [],
  "tags": [],
  "events": [
    {
      "name": "Some Event 1",
      "uuid": "event-1",
      "date": "2022-11-15T20:00:13.043Z",
      "excerpt": "Excerpt",
      "content": "Some more details"
    },
    {
      "name": "Some Event 2",
      "uuid": "event-2",
      "date": "2022-10-15T20:00:13.043Z",
      "excerpt": "Excerpt",
      "content": "Some more details"
    },
    {
      "name": "Some Event 3",
      "uuid": "event-3",
      "date": "2022-09-15T20:00:13.043Z",
      "excerpt": "Excerpt",
      "content": "Some more details"
    },
    {
      "name": "Some Event 4",
      "uuid": "event-4",
      "date": "2022-08-15T20:00:13.043Z",
      "excerpt": "Excerpt",
      "content": "Some more details"
    },
    {
      "name": "Some Event 5",
      "uuid": "event-5",
      "date": "2022-07-15T20:00:13.043Z",
      "excerpt": "Excerpt",
      "content": "Some more details"
    }
  ]
}